원본,번역본
"The explosive growth of data volume and the ever-increasing demands of data value extraction have driven us into the era of big data.", "데이터량의 폭발적인 성장과 데이터 가치 추출에 대한 요구가 계속 증가하면서 우리는 빅 데이터 시대로 접어들었습니다."
"The “5V” (Variety, Velocity, Volume, Value, and Veracity) characteristics of big data pose great challenges to traditional computing paradigms and motivate the emergence of new solutions.", "빅 데이터의 "5V"(Variety, Velocity, Volume, Value, Veracity) 특성은 전통적인 컴퓨팅 패러다임에 큰 도전을 제기하고 새로운 솔루션의 출현에 동기를 부여한다."
"Cloud computing is one of the representative technologies that can perform massive-scale and complex data computing by taking advantages of virtualized resources, parallel processing and data service integration with scalable data storage.", "클라우드 컴퓨팅은 가상화된 자원, 병렬 처리 및 확장 가능한 데이터 스토리지와의 데이터 서비스 통합의 이점을 활용하여 대규모의 복잡한 데이터 컴퓨팅을 수행할 수 있는 대표적인 기술 중 하나이다."
"However, as we are also experiencing the revolution of Internet-of-things (IoT), the limitations of cloud computing on supporting lightweight end devices significantly impede the flourish of cloud computing at the intersection of big data and IoT era.", "그러나 우리도 사물인터넷(IoT)의 혁명을 경험하고 있기 때문에, 경량 엔드 디바이스를 지원하는 클라우드 컴퓨팅의 한계는 빅 데이터와 IoT 시대의 교차점에서 클라우드 컴퓨팅의 번성을 크게 방해한다."
"It also promotes the urgency of proposing new computing paradigms.", "또한 새로운 컴퓨팅 패러다임 제안의 시급성을 촉진한다."
"We provide an overview on the topic of big data, and a comprehensive survey on how cloud computing as well as its related technologies can address the challenges arisen by big data.", "빅데이터 주제에 대한 개요와 클라우드 컴퓨팅 및 관련 기술이 빅데이터로 인해 발생하는 문제를 해결할 수 있는 방법에 대한 종합적인 조사를 제공합니다."
"Then, we analyze the disadvantages of cloud computing when big data encounters IoT, and introduce two promising computing paradigms, including fog computing and transparent computing, to support the big data services of IoT.", "그런 다음 빅데이터가 IoT를 접할 때 클라우드 컴퓨팅의 단점을 분석하고, IoT의 빅데이터 서비스를 지원하기 위해 포그 컴퓨팅과 투명 컴퓨팅 등 두 가지 유망한 컴퓨팅 패러다임을 소개한다."
"Finally, some open challenges and future directions are summarized to foster continued research efforts into this evolving field of study.", "마지막으로 이러한 발전적인 연구 분야에 지속적인 연구 노력을 기르기 위한 몇 가지 열린 과제와 향후 방향을 정리하였다."
